<?xml version="1.0" encoding="UTF-8"?>
<xs:schema xmlns:xs="http://www.w3.org/2001/XMLSchema" elementFormDefault="qualified">
  <xs:element name="functions">
    <xs:complexType>
      <xs:sequence>
        <xs:element maxOccurs="unbounded" ref="action"/>
      </xs:sequence>
    </xs:complexType>
  </xs:element>
  <xs:element name="action">
    <xs:complexType>
      <xs:sequence>
        <xs:element ref="call"/>
      </xs:sequence>
      <xs:attribute name="name" use="required" type="xs:NCName"/>
    </xs:complexType>
  </xs:element>
  <xs:element name="call" type="xs:string"/>
</xs:schema>
